{
  "meta": {
    "schema_id": "frida-visual-overlay",
    "schema_version": "1.0.0",
    "generated_at": "2026-03-11T01:28:23.013Z",
    "contract_sha256": "118946fd47765ea88ba830717db6e3cac04f1189af1abd2ad238cbc83f7ec10a",
    "source": "contract/contract.index.yaml",
    "overlay_path": ".frida/contract/visual/canon-overlay.json",
    "builder_entrypoint": "src/visual.ts",
    "builder_command": "frida-core visual",
    "projection_authority_ref": "FRIDA_VISUAL.component_projection",
    "projection_unit_count": 0,
    "component_boundary_count": 0,
    "topology_node_count": 0,
    "topology_edge_count": 0,
    "flow_node_count": 0,
    "flow_edge_count": 0,
    "specification_node_count": 0,
    "specification_edge_count": 0,
    "dependency_edge_count": 0
  },
  "projection_units": [],
  "component_boundaries": [],
  "topology_nodes": [],
  "topology_edges": [],
  "flow_nodes": [],
  "flow_edges": [],
  "specification_nodes": [],
  "specification_edges": [],
  "entry_points": [],
  "exit_points": [],
  "mounted_child_relations": [],
  "continuation_mappings": [],
  "return_mappings": [],
  "dependency_edges": [],
  "context_shell_hints": [],
  "trace_projection_hints": []
}
